{"$schema": "http://json-schema.org/schema#", "type": "object", "properties": {"id": {"type": "string"}, "title": {"type": "string"}, "availability": {"type": "null"}, "channel_follower_count": {"type": "null"}, "description": {"type": "string"}, "tags": {"type": "array"}, "thumbnails": {"type": "array", "items": {"type": "object", "properties": {"url": {"type": "string"}, "height": {"type": "integer"}, "width": {"type": "integer"}}, "required": ["height", "url", "width"]}}, "modified_date": {"type": "string"}, "view_count": {"type": "integer"}, "playlist_count": {"type": "integer"}, "channel": {"type": "string"}, "channel_id": {"type": "string"}, "uploader_id": {"type": "string"}, "uploader": {"type": "string"}, "channel_url": {"type": "string"}, "uploader_url": {"type": "string"}, "_type": {"type": "string"}, "entries": {"type": "string"}, "extractor_key": {"type": "string"}, "extractor": {"type": "string"}, "webpage_url": {"type": "string"}, "original_url": {"type": "string"}, "webpage_url_basename": {"type": "string"}, "webpage_url_domain": {"type": "string"}, "epoch": {"type": "integer"}, "_version": {"type": "object", "properties": {"version": {"type": "string"}, "current_git_head": {"type": "null"}, "release_git_head": {"type": "string"}, "repository": {"type": "string"}}, "required": ["current_git_head", "release_git_head", "repository", "version"]}, "yt_dlapi": {"type": "object", "properties": {"timestamp": {"format": "date-time", "type": "string"}, "url": {"type": "string"}, "params": {"type": "object", "properties": {"extract_flat": {"type": "boolean"}, "process": {"type": "boolean"}}, "required": ["extract_flat", "process"]}}, "required": ["params", "timestamp", "url"]}}, "required": ["_type", "_version", "availability", "channel", "channel_follower_count", "channel_id", "channel_url", "description", "entries", "epoch", "extractor", "extractor_key", "id", "modified_date", "original_url", "playlist_count", "tags", "thumbnails", "title", "uploader", "uploader_id", "uploader_url", "view_count", "webpage_url", "webpage_url_basename", "webpage_url_domain"]}
